{
  "$schema": "https://json-schema.org/draft/2020-12/schema",
  "$id": "https://truealpha.local/schemas/integration-lease.schema.json",
  "title": "TrueAlpha IntegrationLease",
  "type": "object",
  "additionalProperties": false,
  "required": [
    "schema_version",
    "lease_id",
    "batch_id",
    "owner",
    "state",
    "paths",
    "base_sha",
    "expires_at"
  ],
  "properties": {
    "schema_version": {"const": 1},
    "lease_id": {"type": "string", "pattern": "^integration-lease:[0-9a-f]{64}$"},
    "batch_id": {"type": "string", "minLength": 1},
    "owner": {"type": "string", "minLength": 1},
    "state": {"enum": ["active", "expired", "revoked"]},
    "paths": {
      "type": "array",
      "minItems": 1,
      "uniqueItems": true,
      "items": {"type": "string", "minLength": 1}
    },
    "base_sha": {"type": "string", "pattern": "^[0-9a-f]{40}$"},
    "expires_at": {"type": "string", "format": "date-time"}
  }
}
