{
  "schema_version": 1,
  "lease_id": "integration-lease:8697128e0c55a843115aefefe02108257fc04cdd07381a321461ed9791112b4d",
  "batch_id": "A0-governed-research-access",
  "owner": "wangzitian0",
  "state": "revoked",
  "paths": [
    "init.md",
    "docs/architecture-decisions/A0-governed-research-access.md",
    "libs/contracts/src/truealpha_contracts/__init__.py",
    "db/migrations/0024_access_policy_bindings.sql",
    "db/roles.sql",
    "db/tests/governed_research_access_contract.sql",
    "governance/capabilities/issue-229.v1.json",
    "governance/vision-issue-graph.json",
    "governance/gate0/README.md",
    "governance/gate0/manifest-v5.json",
    "governance/gate0/v4-frozen-tree-proof.v1.json",
    "governance/schemas/gate0-candidate-manifest.schema.json",
    "governance/schemas/handoff-manifest.schema.json",
    "governance/schemas/rung-evidence.schema.json",
    "libs/runtime/tests/test_gate0_candidate.py",
    "libs/runtime/tests/test_delivery_governance.py",
    "tools/check_gate0_candidate.py",
    "tools/check_delivery_governance.py"
  ],
  "base_sha": "e058c0baba69af0e724b116709cbe5d82dbbd268",
  "expires_at": "2026-07-30T00:00:00Z"
}
